Words,Translation
その中間に 1 つの島がある,There is one island in the middle.
名古屋は東京と京都の中間にある,Nagoya is in the middle of Tokyo and Kyoto
中間の立場を取る,I'll take the middle ground.
これ以上のことは人間にはできない,No human can do better than this
人間の能力の限界に挑戦する,Pushing the limits of human ability.
間もなく3 番線に名古屋行きの急行がまいります,The express train to Nagoya will be arriving on track 3 shortly.
間もなくお呼びしますので少々お待ちください.,Please wait a moment. I'll call you shortly.
もう間もなく夜が明ける,It's almost dawn.
約束の時間に間に合わない,I'll never make it to my appointment.
締め切りに間に合う,I'll meet the deadline.
開演に間に合う,I'll make it in time for the show.
7 時の列車に間に合う,I can make the 7:00 train.
式場にはゆっくり間に合った,I made it to the ceremony in time.
重大な間違い,Serious mistakes
釣り銭の間違い,Wrong change
不注意による間違い,Inadvertent mistake
私の記憶に間違いがなければ,If I'm not mistaken.
彼の報告は間違いだらけだ,His report is full of errors.
と言っても間違いでない,It's not a mistake to say
間違いを指摘する　,I'll point out the mistakes.　
間違いを直す,Correcting mistakes
世間到る所に,The world is full of them.
そんなことを言っても世間が承知しない,The world doesn't know that you're saying that
世間が狭い,The world is too small
世間に吹聴する,Spread the word
世間に広まる,Spread to the world
世間に認知される,The world knows
週間天気予報,Weekly weather forecast
今日から 4週間後に,Four weeks from today
3週間にわたって,Over the next three weeks
太るから私は間食をやめた,I've stopped snacking because I'm gaining weight
間食を控えるよう医者に言われている,I've been told by my doctor to cut back on snacking
間接的な被害をこうむる,Indirect damage
間接的な関係,Indirect relationships
人から間接的に聞いた話では　,I heard indirectly from people that　
国内産業への間接的な影響,Indirect impact on domestic industry
二人は出会った瞬間恋に落ちた,"The moment they met, they fell in love."
その瞬間が永遠のように感じられた,That moment felt like an eternity.
その瞬間に彼女の優勝が決まった,That moment was the moment she won.
それはちょっと目を離した瞬間の出来事だった,It was the moment I took my eyes off her.
仲間から締め出す,Shutting out your friends
仲間と示し合わせる　,I'm going to make a point with my friends.　
いつもの仲間で街に繰り出し,He went out on the town with his usual friends.
彼は街の不良の仲間に入った,He joined the gang of delinquents in town.
仲間に入りませんか?,Would you like to join them?
彼は昼間働いて夜学校へ行く,He works during the day and goes to school at night.
定められた期間が過ぎると無効になる,"After a set period of time, it becomes invalid."
期間が過ぎる,The period expires.
期間を延長する,Extend the period.
期間を短縮する,Shorten the term.
期間を 2 年に限る,Limit the period to two years
海外勤務の期間はどのくらいの予定ですか,How long do you plan to work overseas?
池の水が凍った,The water in the pond froze.
花瓶のバラに水が上がった,Water rose on the roses in the vase.
今年の夏は全国的に水が不足している,Water is in short supply all over the country this summer.
袋の水がもれた,Water leaked out of a bag.
新潟県は水がいいから酒造りに適している,"Niigata Prefecture has good water, which is suitable for sake brewing."
僕は水泳は少しもできない,I'm not even a good swimmer.
水泳の練習をする,I practice swimming.
水泳の達人,An expert swimmer
水道の水をやかんに入れる,Filling a kettle with water from the tap
水道の引いてある部屋,A room with running water
水素を添加する,Add hydrogen
うっとりするような香水の香り,The smell of perfume is intoxicating.
香水のにおいがぷんぷんする,The smell of perfume in the air
香水を振りかける,Sprinkle perfume
香水を吹きかける,Spraying perfume
香水をつける,Add perfume
塩水を淡水にする,Turn salt water into fresh water
淡水化する　,Desalination　
水分を吸収する,Absorb water
水分を含んでいる,Contain water
水分を補給する,Replenish water content
水分定量,Moisture metering
水分除去,Moisture removal
水平軸,Horizontal axis
水平にする,Leveling
水平思考,Horizontal thinking
川の水源をきわめる,Determine the source of water in the river
水源が枯れてしまった,The water source has dried up.
夏はたいてい海水浴に行く,I usually go swimming in summer.
鎌倉で海水浴をする,I go swimming in Kamakura.
僕の水筒、どこかな？,Where is my water bottle?
僕の水筒、空っぽなんだけど,My water bottle is empty.
水筒にはほとんど水が残っていない,There's hardly any water left in my water bottle.
噴水から水が出ていた,There was water coming out of the fountain.
噴水の水は循環しています. 飲まないでください,The water in the fountain is circulating. Please don't drink it.
噴水を設ける,Set up a fountain
水準が高くなる,Raising the water level
世界的な水準を上回る　,Higher than global standards　
生活水準,Standard of living
高い教育水準を維持する,Maintain high educational standards
国際的水準からすれば,By international standards
水準点,Water level point
下水が詰まった,Sewage clogged
雨水を下水に流す,Discharge rainwater into the sewer
下水を掃除する,Cleaning the sewage
大気中の水蒸気,Water vapor in the atmosphere
水蒸気を出す,Emit water vapor
水蒸気となって発散する,Dissipate as water vapor
水蒸気圧,Water vapor pressure
本を元のところに置く,Put the book back where it belongs.
子供によい本を選んでやる,Choose a good book for your child
本を読みながら眠ってしまう,Falling asleep while reading a book
日本改造計画,Japan Remodeling Project
日本型経営,Japanese-style management
本日のランチの内容はなんですか,What's for lunch today?
これが本日のおすすめ料理です,This is today's recommended dish.
本日ご覧ください,Please take a look today.
オープンセールを行っております,We are having an opening sale!
彼は左腕一本でその重い荷物を持ち上げた,He lifted that heavy load with his left arm alone.
彼は半年に一本のペースで論文を書いている,He writes one paper every six months.
本棚に本を並べる,Putting the books on the bookshelf
本棚を組み立てる,Assembling the bookshelf
本当のことを言えば,To tell you the truth.
本当のところはどうなんだ?,What's the real story?
本当の意味での幸福　,The real happiness　
本当の年を教えてください,Tell me the real year
彼は決して本当の気持ちを明かさない,He never reveals his true feelings
その語の本当の意味において,In the true meaning of the word
本能のままにふるまう,Acting on instinct
本能によって生きる,Live by instinct
母性本能を発揮する,Exercise your maternal instincts
の議論は問題の本質から外れている,The discussion of the following is not the essence of the matter
人間の本質,Human nature
問題の本質を探る,Search for the essence of the problem
日本文化の本質に触れる思いがする,I feel that I am in touch with the essence of Japanese culture
本物と偽物とを見分ける,Distinguishing the real from the fake
本物そっくりのブランド品,Brand-name products that look like the real thing
この造花はまるで本物のようだ,These artificial flowers look like the real thing.
彼はこれを本物だと言って売りつけた,He sold it to me as the real thing.
基本に立ち返る,Going back to basics
基本に忠実に従って練習する,Practice by following the basics.
私は健康のために野菜や魚中心の和食を基本にしています,"I base my diet on Japanese food, mainly vegetables and fish, for my health."
和服は直線が基本になっている,Japanese clothes are based on straight lines
基本を学ぶ,Learn the basics
基本を身につける,Learn the basics
基本を応用する,Apply the basics
基本を守る,Keep the basics
基本給と諸手当,Basic salary and allowances
基本原料,Basic raw materials
基本構想,Basic concepts
基本財産,Basic Property
基本合意,Basic agreements
基本語彙,Basic vocabulary
基本政策,Basic Policy
基本設計,Basic Design
基本戦術,Basic Tactics
基本料金,Basic Charges
本来の意味を失う,Lose the original meaning
肌本来の働きを助ける化粧品,Cosmetics that help the skin's natural function
人間に本来備わっている免疫機能　,Immune function that is inherent in humans　
本来花粉は人体に無害なものだ,Pollen is essentially harmless to the human body
日本語学校,Japanese Language School
日本語教育,Japanese language education
本音と建て前を使い分ける,How to distinguish between real feelings and pretense
本音をさらけ出す,Revealing your true feelings
本音を吐く,Revealing one's true feelings
本文の筆者,The author of the main text
この本は本文の部分はそんなに多くない,There aren't many body parts in this book.
この本文の全ての行を翻訳しなさい,Translate every line of this text.
この情報は注釈ではなく本文で扱うべきだ,"This information should be dealt with in the text, not in the endnotes"
今からでも遅くはない,It's not too late.
今から行って列車に間に合うかしら,I don't know if I can catch the train if I go now.
今日に至るまでの経過,What happened before today?
今日に至るまで彼の消息は不明である,"To this day, his whereabouts are unknown."
遠く今日となってはもはや真相の解明は難しい,"Today, so far away, it is difficult to find out the truth."
今日ただ今の状況,"The situation today, right now"
私の今日の地位,My position today
通信手段の発達した今日では,In today's world of communication
今週私はずっと病気で寝ていた,I've been sick in bed all week.
今週はこのくらいにしておこう,That's about it for this week.
今月分の新聞代,This month's newspaper bill
今月分の給料,This month's salary
その作業は今年中続きま,The work will continue for the rest of the year.
その企画は今年中に終わります,That project will be finished by the end of this year.
今年は雨が多かった,It rained a lot this year.
今年の夏休みはどこへ行きましたか,Where did you go on your summer vacation this year?
今後のことは私に任せなさい,I'll take care of the future.
どうなるかは今後のことだ,We'll see what happens.
今後は君に送金する義務はない,I'm not obligated to send you money from now on.
今ごろはもう奈良に着いているに違いない,I'm sure you're in Nara by now.
"遅いじゃないか, 今ごろまでどこで何をしていたんだ",Where have you been all this time?
彼は今ごろどうしているだろう,I wonder how he's doing by now.
今ごろ沖縄では桜が満開だろう,The cherry blossoms must be in full bloom in Okinawa by now.
今度の人事異動で課長に昇進した,I've been promoted to section chief in the next personnel change.
今度の試験はうまくいった,The next exam went well.
いつも今度のようにうまくいくとは限らないぞ,It doesn't always go as well as this time.
今度は彼は合格まちがいなしだ,He's sure to pass this time.
今度までに手続きを終わらせておきます,I'll finish the paperwork by next time.
また今度寄ってください,Please come by again sometime.
今朝から頭痛がする,I've had a headache since this morning.
今晩はもうやすみましたから明日またお電話ください,"I've had a good night's sleep, so please call me tomorrow."
このホテルへ泊まるのも今夜が最後だ,This is the last night I'll be staying in this hotel.
今夜はこれで散会としよう,Let's call it a night.
魚は今夜中はもつだろう,I think the fish will last the night.
今回の公演はとてもよかった,This was a very good show.
今回だけは大目に見てやる,I'll tolerate you for once.
今回かぎりの大安売り,"Just this once, a bargain."
今に英語が話せるようになる,You'll speak English now.
今に降りだすよ,It will start to rain now.
今に必ず食糧危機が来る,There will be a food crisis.
今にも降りだしそうだ,It's gonna start raining any minute.
あの会社は今にも倒産しそうな状態らしい,I heard that company was about to go bankrupt.
船は今にも沈みそうだった,The ship was about to sink.
今までずっと,All this time.
今までよりも,More than ever.
今までどおり,It's the same as it's always been
今までの経験を生かしたい,I want to make the most of what I've done.
事情は今までとは大違いだ,Things are very different now.
今までは彼の言うことを信じていたのだが,"Up until now, I've trusted what he's told me."
学生だった今までと違ってこれからは責任が重いぞ,"I was a student, but now I have a lot more responsibility."
私は今でも彼女の名前を覚えている,I still remember her name.
