Script,Meaning
このモジュールを使用すると、エンターキーでイベントを生成することができます。,This module allows you to generate an event with the enter key.
この車は過去１０年間使用されてきた。,This car has been in use for the past ten years.
こちらで人気の和食ランチが、季節の野菜を使用した天ぷら「御膳」です。,"One of the most popular Japanese lunches here is the ""Tempura Gozen"" using seasonal vegetables."
古民家を改装した、あたたかい雰囲気のカフェ・レストランです。,It is a café/restaurant with a warm atmosphere in a renovated old house.
こちらも大人気店なので、ランチでも予約しておくことをおすすめします。,"This is also a very popular restaurant, so it is recommended to make a reservation even for lunch."
こちらも人気店なので、ランチでも予約しておいたほうがいいでしょう。,"This is also a popular restaurant, so it is best to make a reservation even for lunch."
素材にこだわった季節の天ぷら御膳,Seasonal Tempura Gozen with a focus on ingredients
素材の旨みをいかして、シンプルにいただきます,It's a simple dish that lets the flavor of the ingredients shine through.
油で揚げられており、衣も玄米米粉を使用しているなど、体にもとっても優しいです。,"It is fried in oil and the batter is made of brown rice flour, making it very healthy for you."
健康志向の女性たちには嬉しいですね！,That's great for all you health-conscious ladies out there!
続いてご紹介するのは、四条駅から徒歩1分ほどの場所にある「京菜味のむら 錦店」です。,"The next place I'd like to introduce you to is the Nishiki branch of Kyona Ajinomura, located about a minute's walk from Shijo Station."
人気観光地である錦市場からすぐというアクセスしやすい場所にあります。,"It is easily accessible from Nishiki Market, a popular tourist spot."
名物の湯葉丼と、美しい器に盛られた12種類ものおばんざいをセットいただける、贅沢な京ランチが人気のお店です。,"The restaurant is popular for its sumptuous Kyoto-style lunch, which includes its famous yuba rice bowl and 12 different types of obanzai served in a beautiful bowl."
こんなにも美しく、ボリューミーなおばんざい御膳を2000円以下でいただける、神コスパも人気の理由のひとつです。,"One of the reasons for the popularity of this restaurant is the divine price of less than 2,000 yen for such a beautiful and voluminous banzai set."
またランチタイムでも予約することができるので、1日の予定がたてやすいです。,"You can also make reservations during lunch time, making it easy to plan your day."
京和食の優しい味を堪能したい方におすすめです。,Recommended for those who want to enjoy the gentle taste of Kyoto Japanese cuisine.
こんなことを楽しみたい方にお勧めです。,Recommended for those who want to enjoy this kinda of a thing
続いてご紹介するのは、JR京都駅から徒歩5分ほどの場所にある「漬け野菜 iSOiSM（イソイズム）」です。,"The next place I'd like to introduce you to is ""Pickled Vegetables iSOiSM,"" located about a five-minute walk from JR Kyoto Station."
春が訪れた京都。桜や新緑の季節は、京都をより美しく魅せてくれますよね。,Spring has arrived in Kyoto. The season of cherry blossoms and fresh greenery makes Kyoto even more beautiful!
