若い男に彼女はバッグを奪われた。,クリスマスシーズンで一番好きなところは何ですか。,まだまだたっぷりと遊ぶ時間はあるぜ。,彼はローマに行って、そこで多くの古い建物を見た。,殿方が細かいことにこだわるものではありません。,トムと呼んで。,コーヒー、一口いただいてもいいかしら？。,ちょっと話があります。,追加しておきたいことは何かありますか？。,スイスは訪れる価値のある美しい国です。
その男は私から財布を奪った。,私たちは今シーズンたくさん試合をした。,まだまだ勝負は分からない。,あのでかくて新しい建物は何なの？。,生産性はオートメーションの徹底によって向上する。,タクシーを呼んであげましょうか。,一口乗りたがっている人が大勢だ。,ちょっとアイス買ってきてもいい？。,追加してくれてありがとう。,ケイトのお父さんは家の周辺にいる。
お前はすべてを奪っていった。,今シーズンは我々のチームがリーグで優勝した。,子供の持ちたがらない日本人が増えている。,彼はローマに行ってたくさんの古い建物を見た。,ためらうことなく、その陰謀にたいする徹底した対抗処置をとった。,あなたをボブと呼んでもいいですか。,一口食べてもいいですか。,ちょっとねえ。,これらの番号を追加できますか？。,その州は周辺にさまざまな原料を供給している。
光に目を奪われないで。,釣りのシーズンはいつ始まりますか？。,最近海外へ行く学生が増えている。,現在の建物はとても古い。,厳格な父親は、徹底したしつけによって子供たちに決まりごとを守らせる。,ヨロパーのすべてのところに行くことがありました。,彼は一口食べてまた一口食べた。,女王のクラウンは黄金でできています。,Tatoebaに最後に文を追加したのはいつですか？。,大工場が街の中や周辺に作られると、人々が仕事を求めてやってきて、まもなく産業地域が出来始める。
パーマは自然な感じにしますか。,我々は天然の資源を保存するように勤めなければならない。,これで私の悩みが増える。,あの建物は私たちの学校です。,あなたは徹底した人間嫌いですね。,これが私の知っているすべてです。,私はりんごの甘酸っぱい味が好きだ。,彼は銀の木がある黄金の都についてすばらしい話を聞いたことがあった。,どのスカートがお好みですか。,ブレークはロンドン周辺の郊外を歩くのを好んだ。
アフリカにはたくさんの自然がある。,シドニーは天然の美しい港がある。,海外へ行く学生の数が増えている。,春は私が一番好きな季節だ。,イクラって何がおいしいのかわからない。,すべてオーケーだ。,できることならもう一度、中学生みたいな甘酸っぱい恋がしてみたいなあ。,絵の中の少女は黄金ではなくて花のかんむりをかぶっています。,特にお好みの色とかおありですか。,事前の申し込みは必要ありません。
人間は自然の一部である。,やっぱり天然アユの塩焼きは最高だね。,車の数が増えている。,私は季節の中で春が好きだ。,このパンはとてもおいしい。,すべてしましたか?。,あなたと一緒にいて楽しかった。,黄金のベッドで眠る金持ち。,コーヒーのお好みは。,事前に準備しておこうよ。
私たちは自然をよい状態にしておかなければなりません。,我々は天然の資源を保存するように勤めなければならない。,時は、その中で釣をする流れである。,夏は私が一番好きな季節だ。,このクッキーは高くないが、おいしい。,すべてを知ることはできない。,トムと一緒にオーストラリアに行くことにしたよ。,王女は黄金のティアラをかぶっています。,お好みに応じて塩とこしょうを加えてください。,事前にお知らせします。
アフリカは自然がいっぱいだ。,シドニーは天然の美しい港がある。,たまにその中に塩をちょっと入れてるよ。,あなたはどの季節が一番好きですか。,このワイン、おいしいんだよ。,自家製です。,一緒に来てくれませんか。,ワープロがタイプライターに変わろうとしている。,牛肉と小羊の肉のうちどちらがお好みですか。,事前にお知らせいたします。
飛行機からアルプスの雄大な眺めを楽しんだ。,やっぱり天然アユの塩焼きは最高だね。,私はときどきその中に少しの塩を入れる。,スキーの季節は過ぎた。,本当においしそう。,これは自家製のジャムです。,一緒にいってやってみない？。,私のｅ—ｍａｉｌアドレスが変わりました。,わたしはとても楽しい。,今度私の車を使うときは、事前に私に聞いてください。
なんて雄大な風景なんでしょう。,その事実に関しては秘密をまもらなくてはならない。,彼の母親には３人の息子がいたが、その中で彼は一番若かった。,彼にもう一杯いかがかと問う。,彼女はドアを開けるまで寒さに気付いてなかった。,あの老人は５０年も自家製ウイスキーを作っていた。,一緒に行きます。,それにより状況が変る。,とても楽しかったです。,エンジンをチェックしましたか。
それは実に雄大な眺めだ。,私にその秘密を教えてくれませんか。,彼がその中に住んでいた小屋。,人間は狂っていれば行動の責任は問われない。,彼は決して寒さを感じないようだ。,それは初めて聞く話です。,夢は広がるばかりです！。,ここはほとんど変わっていない。,凄く楽しいです。,メールをチェックしたかっただけ。
この雄大な海の眺めをごらんなさい。,誰か彼の成功の秘密を知っていますか。,バターはミルクから出来る。,知らずば人に問え。,今年の冬は寒さが厳しいですね。,私は初めてコアラを見た。,最近、アメリカでコロナウイルスがどんどん広がってるんだ。,彼女は変わりたいって言ってる。,テニスをするのは楽しい。,今チェックしたよ。
軽井沢は避暑地として有名である。,彼は秘密を知っている様だ。,トムさんはジョンさんにメアリさんからのメッセージがあります。,あなたの人種、年齢、宗教は問いません。,彼は昨夜の寒さが原因で死亡した。,カレーを初めて作りました。,そのにおいは学校中に広がった。,クリームは、脂肪とたんぱく質が濃縮した濃厚で、白色や薄黄色の液体。,ゴルフをするのはとても楽しい。,あなたのオーダーをチェックしろ。
海岸の避暑地は、例えばニューボートがそうだが、夏には非常に混雑する。,それは秘密にしておいた方がいい。,テレビを見ているからです。,警察は彼を、隣国に情報を流したという罪に問った。,この寒さにはもう耐えられない。,日本は初めてですか。,エイズは、それぞれがそれに対して行動をとれば広がるのを防ぐことができる。,味も濃厚で、炒め物、スープなど中華の料理に深みを与えます。,トムは今日の夕方コンサートに行きます。,ＯＳとブラウザは？。
軽井沢は避暑地として有名である。,彼の踊りは堂に入ってる。,そのグラスはからだった。,その新しいスーパーは先月開店した。,時間をかけてゆっくりやりなさい。,初めてドリアンを食べました。,火はあなたの足より速く広がることがある。,「学園の廊下で、濃厚なキスシーン・・・聞いたぞ聞いたぞ」「濃厚じゃなーい！話に尾ひれ付いてるって・・・」。,夕方までには彼女は仕事を終えているでしょう。,トムはメアリーとエッチしました。
海岸の避暑地は、例えばニューボートがそうだが、夏には非常に混雑する。,成歩堂先生の事務所が「エネルギー分野における世界有数の法律事務所」である。,それって、トムから？。,何時開店ですか。,彼は私にもっとゆっくり話すように言いました。,その山は一年中雪をいただいている。,おまわりさんに車を片側に寄せるように合図された。,インサイダー取引に当たる疑いが濃厚になってきた。,今日夕方ニコラと一緒にレストランで無料のミントティーを飲んだ。,ダイエットしようとした。
そこですばらしい滝を見た。,氷をバケツ１杯持ってこさせてくれ。,このラグはハンドメイドです。,私は角を曲がって、開店早々の食堂を見つけた。,ゆっくり歩いてよ。,彼は一年中そこで暮らして仕事をしている。,ヒラメの成魚は、顔の片側に両目があります。,そのメロンは甘い香りがして、とても味が良い。,明日の夕方には戻るよ。,トムとメアリーはボードゲームをした。
男が１人滝に打たれていた。,この氷はだいじょうぶかしら。,このバイクって、トムの？。,食堂ってもう開店した？。,もっとゆっくり車を走らせてください。,君と一緒だと、一年中が夏だ。,ピンクは女の子のためだけにあるんじゃないんだよ。,そのチーズケーキは味が甘すぎた。,ある夕方、一人の男がやってきた。,トムはメアリーとトランプをしている。
雨が滝のように降ってきた。,以前は氷を売ることなどだれも思いつかなかった。,このデスクは300ドルした。,何時に開店しますか。,彼はゆっくりと歩く。,そこは一年中暖かい。,あなたの意見を「はい」か「いいえ」だけに制限しないでください。,オレンジはレモンよりも甘い。,９時以降に電話した方が安いですか。,ティッシュはいいよ。
滝のような汗が顔から流れ始めた。,その島は冬の間、氷と雪でおおわれる。,このフロッピーをフォーマットしてはいけません。,私も前ニューヨークにいました。,私はこの小さな町で育った。,彼らは一年中働かなければならなかった。,その母親は子供たちだけにしておきたくなかった。,このワインは甘すぎると思うよ。,九時以降はテレビを見ないことにしている。,いいタイミングだ。
谷は滝の音を反響する。,私達は氷の上を歩いて渡った。,このページをコピーして下さい。,私は太郎を１０年前から知っています。,トムはボストンで育ったけど、今はシカゴで暮らしている。,彼女があのピンクのドレスを着た姿はまさに絶品だった。,空いておりますのは、ダブルのお部屋だけになります。,私は甘いケーキがとても好きだ。,その駅は、明日以降から終了します。,私がコンサートに行けるといいのだが。
もっと涼しい日に行くべきだったね。,君は彼目当てにして良い。,私は駅に行った。,４２ストリートのレストランの前です。,あなたはボストンで育ったのだと思っていました。,ジョンと言えば、彼の妹はどうなったかな。,長年家から離れていた後だけに、トムは家にいて幸せだった。,原因と結果はお互い作用し合う。,おそらく午後７時以降は食べない方がよいでしょう。,彼らは私の果実園からりんごを盗んだ。
それは涼しい所に保存しなさい。,よい席をとることを目当てに早めに劇場にいった。,グランド・セントラル駅までやってください。,前はよくピザを食べていました。,オーストラリアのどこで育ったのですか。,スポーツといえば、あなたはどんなスポーツをされますか。,50ポイントのテレホンカード。,酸は金属を含むものに作用する。,１０時以降に朝食は出されないだろう。,私は、甲子園球場に行く。
朝の涼しい時に勉強をしなさい。,彼は財産目当てで結婚した。,駅へ行って来たところだ。,前はよくピザを食べてました。,見て、モーツァルトを聴いて育ったトマトだって。,私が持っているものと言えば本だけです。,これはとても重要なポイントです。,酸は、金属に作用する。,モールの中に、比較的大きなシネコンがある。,彼らは私の果実園を荒らした。
今朝は涼しいですね。,これがやつらの目当てじゃないとしたら、一体やつらの目的は何なんだ？。,駅までタクシーで行ったよ。,一つ選んで。,日光と水とは植物を育てる元になるものである。,私と言えば、こちらの方が好きだ。,彼はポイントを生徒に充分わからせた。,酸は金属を含む多くのものに作用する。,比較的難しいジグソーだと感じました。,８月下旬に彼らは繁殖のために長い旅に出発します。
涼しくてよかったのですが、もう寒くなってきました。,財産目当てに結婚するものは自由を売り渡すものである。,駅からタクシーで来ました。,一つ食べてみよう。,もちろん空気は日光とともに、毎日の生活に欠かせぬものである。,私といえば、こちらの方がすきだ。,日経平均は２００ポイント下げ、昨日は１８、０００で終えた。,日光は皮膚に作用する。,平日は比較的混んでいないようです。,その結果、５月下旬に不安神経症や不眠症と診断された。
ひんやりした空気のせいで、トムは意識を回復した。,子どもたちがサーカスの行列を追いかけた。,彼は徒歩か自転車で来る。,ニュースを一つ持ってきた。,日光は皮膚に作用する。,やっぱり、あなたは私の思ったとおりの人だった。,議論の重要なポイントはこれまでに述べてきたとおりである。,彼のアイデアの方が君のものよりも優れている。,このホテルはこの町にしては比較的高い。,お祭りは今年も例年通り開催された。
空気がなかったら、人間は生きられないだろう。,彼は行列を見ようと首を伸ばした。,ジョンは彼のオフィスへ徒歩で行きます。,テーブルの上にメロンが一つあります。,私たちは翌日日光を訪れた。,いろいろな国へ行ったがやっぱり日本が一番いい。,トムがメアリーのこと好きだって、本当に思ってるの？。,このコンピューターのほうがあれより優れている。,国が保存するほどの重要性を持った建物は比較的無事である。,今年は桜の花が例年よりも少し遅れている。
空気読んでよ。,行列が学校の側を通った。,学校へは徒歩で３０分かかる。,一つ知りたいことがあります。,その子はあまりにも長く日光にさらされた。,やっぱり、彼が来なかった。,トムはメアリーが好きだって、分かってるわ。,彼は多くの点で私より優れている。,通りは自動車で混雑してきた。,今年は例年より桜は早いだろう。
タイヤに空気をいっぱい入れよ。,市長は行列の先頭に立って歩いた。,学校は、駅から徒歩５分以内のところにあります。,夏休みはどこかへ行きましたか。,トムはこれを見たがっている。,それでもそれはやはり本当だ。,トムがバーテンダーだってことは知ってるよ。,彼女の作品は私のより優れている。,その店は昨日たまたま混雑していた。,今年は例年より雪が少ない。
誰が空気を発見したのか、教えて下さい。,日本では駅での整然とした行列を見ることができる。,今度は徒歩か自転車でそこに行くつもりです。,夏休みが過ぎた。,これ見てよ。,トムはやっぱりパイナップルのアップサイドダウンケーキが大好きです。,これからメアリーと話に行くところだって、トム言ってたよ。,これはあれよりも優れている。,通りは人々で混雑していた。,例年、うちでは感謝祭の日に七面鳥を食べるんだ。
空気読みなよ。,超ロマンティックだわ！。,私は３０分以上もまたされた。,この夏休みは働こうと思いました。,これね、私のだと思うんだ。,いちごあるけど食べる？。,トムはメアリーが好きだって知ってるよ。,彼は最高のフットボール選手だったといわれる。,道路はいろいろな車で混雑していた。,私は車を買う気がしない。
なんだか目が冴えちゃって、眠れなくなっちゃった。,超おすすめだよ。,プレゼンテーションのために二三十分時間をください。,残りの夏休みは働くつもりです。,私が言いたいのは、これ。,あなたは、いちごが好きですか？。,この酒には独特の味わいがある。,私達は来るなと言われるとますます行きたくなるものだ。,その電車は人々で混雑していた。,車をお持ちですか？。
昨日ゆっくり休んだ分、今日は頭が冴えている。,ここには超厳しいルールがあるんだ。,1時間は60分です。,今年の夏休みは、どこに遊びに行きたい？。,これを見て。,明日、彼氏と私はいちごケーキとピザを食べる。,オーストラリアにぜひ行ってみたい。,彼は以前、大変な金持ちだったと言われる。,ゴルフではスコアが少ないほど良い。,トムは車のラジオをつけた。
もう午前3時だけど、目が冴えて眠れる気がしない。,これをやってくれれば超基本が身に付いてくれるのではないか。,２、３分なら時間があります。,お盆期間中は駅はとても混雑する。,コンピューターのキーボードの操作は、手動タイプライターほど努力を要しない。,私はいちごを摘みに行った。,ぜひ聞かせてください。,彼は急げと言われるのをいやがる。,そう思っている人が少ない。,私は車を買うことにした。
私って冴えてる！。,今日は超寒い。,７時４５分です。,出産後でも、授乳期間中のお酒はダメですよ。,その式に参加してくれますか。,メアリーは、ジャムを作るために森でいちごを摘んだ。,ぜひそれをやってみなさい。,トムとメアリーはへとへとみたいだよ。,５は８より少ない。,あなたの車が好きです。
なんだか目が冴えちゃって、眠れなくなっちゃった。,ブラジルではサッカーほど人気のあるスポーツはない。,スポットも行ったの？。,私はその本を読んでいないし、読みたいとも思わない。,式に引き続いてパーティーがあった。,行かないって、言ってるでしょう。,ぜひやってみなさい。,トムはメアリーのこと好きになっちゃったみたいだね。,何の心配もない人は少ない。,暑さで多くのランナーが意識を失った。
昨日ゆっくり休んだ分、今日は頭が冴えている。,アメリカではフットボールほど人気のあるスポーツはない。,その犬は家族にスポットと呼ばれている。,私はその映画を見ていないし、また見たいとも思わない。,暇だろうが忙しかろうがあなたはその式に出なければならないでしょう。,由美はテニスをしないでしょう。,イタリアにいるのだから、ぜひナポリをみなさい。,そう、みたいね。,９０歳まで生きる人は少ない。,彼が引き受けるべきだという私の考えは不動だ。
湖畔にはかなり多くのホテルが有る。,トムはメアリーを説得して考えを改めさせた。,その工場は来年から製造をはじめる。,この本を私は大変評価している。,彼はよく風景を書く。,柿は栄養価が高く、甘いのは最高に美味ですが、時々渋いのがあります。,私は少し離れてその絵を眺めた。,今日はとても暑い。,彼が英語に堪能ならば、私は彼を雇います。,私達は山のふもとの宿に泊まった。
彼は湖畔巡りの旅で我々を案内した。,彼らはその制度を改めた。,このようにして、彼は工場の経営に成功したのです。,この問題に対してあなたがしたことは、とても高い評価を受けている。,そこは風景が美しいので有名だ。,若いころに受けた印象ほど鮮やかに心に残るものはない。,ジョンは座って窓の外を眺めていた。,暑くなりそうだな。,彼が英語に堪能であるなら、彼を雇いましょう。,私達の町にはすばらしいスポーツ施設がある。
我々はその夜湖畔のホテルに宿泊した。,どうして考えを改めたのですか。,その事故が起こったとき、彼はその工場でもう３年間働いていた。,今後旅行の際はぜひ当社をご検討ください。,スイスの美しい風景を楽しんでいるだろうね。,暑い気候が雪を水にかえた。,この部屋から街が大変よく眺められます。,日本では夏は非常に暑い。,冬にはコートを着るんだよ。,うちの大学にはすばらしいスポーツ施設がある。
湖畔の古い教会はとても美しい。,こうした事実から考えてみて、私たちの理論を改めることが必要かもしれない。,あなたがこの工場で働く女性の担当になります。,海外へ旅行する際には、通常、パスポートが必要である。,彼が引き受けるべきだという私の考えは不動だ。,私は気候が暖かくなるまで、イギリスに行くのを延ばすよ。,子供はその動物を面白がって眺めた。,そんな気分じゃなかったんだ。,冬は私の一番好きな季節です。,これは父の働いてる施設だ。
この語句の意味は何ですか？。,君はとてもいい味覚をしてるよ。,テレビを製造している工場を訪問します。,あなたの町へ今度旅行する際、あなたにお会いするのが楽しみです。,この本は初心者でも理解できるようなやさしい英語で書かれている。,日本の気候はイングランドの気候と似ていない。,トムは玄関先に立っていた。,私はアイスクリームを食べるといつも幸せな気分になる。,夏は海に行き、冬は山に行きます。,その会社のメンバーだけがその施設を使う資格がある。
法律文書では難しい言葉や語句がよく使用される。,風邪で彼の味覚は鈍くなっていた。,Ａ社のアニュアルレポートは参考になる。,テニスやピンポンのバックハンドでは手は球を打つ際逆向きになる。,あなたは初心者としてはテニスがうまい。,気候が性格に影響すると思いますか。,商品のお届けは玄関先までとなっております。,パーティーに行く気分じゃないんだ。,冬にはよくスキーに行きました。,会員はだれでもこれらの施設を利用できる。
自分の辞書でその語句を調べてごらん。,これなんていう料理？。,彼も大人になって、物事を総合的な視野で見られるようになった。,私たちは旅行する際には、ペットのことを考慮しなければならない。,初心者でも参加できますか？。,とてもいいんですが、気候がどうもねえ。,トムなら玄関先にいると思うよ。,もう気分は良くなった？。,冬の後に春が来る。,電話案内がコンサートの開始時間を教えてくれますよ。
その作家の文体は挿入語句が多い。,インドネシア料理はお好きですか？。,工業区と商業区が一体となった総合的な開発区を目指しております。,私は兵庫県に住んでいる。,何てこった、初心者にやられた！。,この土地とこの家は私の物ですよ。,スキーの時期は過ぎた。,最高の気分だよ。,チェスをすることに関しては、彼に並ぶものはいません。,ダウンロードを開始するには「保存」ボタンをクリックしてください。
