新しい枕を試すのはわくわくする！。,画像をクリックすると次ページへ移ります！。,彼の心は死んだ子から離れなかった。,クッキーはどれも星の形をしている。,体に悪いよ。,その国は産業によって支えられている。,彼女はまるで先生のように話します。,ホワイトハウスを設計したのは誰ですか。,今度の新人は、チャレンジ精神旺盛でいいね。,この製品を発表するときが来た。
通販で理想的な枕が買えます。,この画像は解像度が低すぎて、画質がとても悪い。,ツアーの間、彼はグループを離れ、自分で歩いた。,また戻ってきます。,人間は皆同じ体をしている。,彼女は名前をアンに変えた。,ライトさんはまるで日本人のように日本語を話します。,彼がその車を設計した。,このモジュールを使用すると、エンターキーでイベントを生成することができます。,その製品は値段が高い。
彼女は枕を二つ使っている。,マリアは卵のサンドイッチをいくつか作った。,駅は少し離れている。,彼が戻るまで私はここで待ちます。,人間は心と体から成っている。,チャンネル変えてもいい？。,まるでひとりで笑っているみたいだ。,彼がその新しいビルを設計した。,私たちは毎日多くの水を使用する。,お願いいたしました製品に関する情報ありがとうございました。
トムはピカチュウの枕を持っている。,この卵は新しいよ。,その町は２マイル離れている。,仕事に戻れ！。,ほのかな光が俺のねじれた視界を幻影に変えてゆく。,気持ちを変えるなよ。,昨晩寝たベッドはあまり寝心地がよくなかった。,このあたらしい町はうまく設計してある。,私たちは多くの水を使用する。,つきましてはカタログを郵送してください。
トムは枕で頭を覆った。,私は卵を一つ持っています。,彼女はすぐに行かなければと言った。,彼が戻るまで待とう。,こういうわけで私は彼を首にした。,私のプロフィール写真、変えた方がいいよね。,横になってみると、そのベッドはとても寝心地がよかった。,田中さんはセールスマンとして採用された。,それはナイフとしても使用されます。,２０以上の注文につきましては、見積りより１０％引きの特別価格でご提供します。
インフルエンザにかかってしまった。,全部で20個の卵が必要です。,彼女はすぐに良くなりますか？。,私が戻ったと、トムに伝えてもらえますか？。,今日、起きたら首に痛みを感じました。,自分のホームページのレイアウトを変えた。,ベッドは寝心地満点だった。,彼はその新方法を採用した。,この車は過去１０年間使用されてきた。,もうこれ以上、デザインを考えられない。
この本を読むのに２時間かかります。,卵が全部で１０個あった。,その本はすぐに手に入ります。,５時にここに来るようにしていただけませんか。,彼が首になった理由を教えて下さい。,彼女はテレビを６チャンネルに合わせた。,あなたのベッドより、私のは寝心地よいです。,私たちは別の方法を採用した。,満開をチョイ過ぎた感はありましたが、それでも、美しい桜を満喫してきました。,彼がその車をデザインした。
そのハイキングは八時間もかかるでしょう。,彼はいつも私に彼の意見を押し付けます。,トムをすぐに行かせます。,８時にチェックアウトします。,彼を首にしてやる。,時間を合わせなさい。,時間内に終わりそうもないと思う。,それが私を採用した理由ですか？。,私はしばしば絶望感に襲われた。,このデザインには中国の影響がみられる。
仕事にかかれ！。,押し付けられると反発しちゃうのが人間っていうものなんじゃないか。,あなたはすぐに行った方が良い。,７時にね。,トムさんはメアリさんが首にしたことに関係なかったんだ。,映画のチャンネルに合わせたいのですが。,彼は時間内に到着した。,彼は彼女の意見を採用した。,動物に道徳感はない。,コンパクト型にはおしゃれなデザインが多いですね。
そのＣＤを買うには１０ドルかかる。,彼らは彼につらい仕事を押し付けた。,その塔を復元してはどうかと提案された。,あなたは５時に来た。,トムはよく肩で風切って歩いている。,彼女は花にピントと合わせようとした。,収入内で生活をするようにしなさい。,そのブレーキはさらにテストしてみる必要がある。,彼女は感極まって泣いた。,新しいデザインは古いデザインよりずっとよい。
あなたはこれを聞いて衝撃を受けるだろう。,その子は顔を店の窓に押しつけた。,その建築家はその建物を復元してはどうかと提案した。,１１時になっているよ。,トムはいつもメアリーの肩ばかり持つ。,力を合わせれば、これを終わらせられるだろう。,電車内で、何か食べるものを買うことはできますか？。,彼は、ガソリンをさらに使わないエンジンを開発した。,そのホテルにはプールやテニスコート等がある。,仕様および価格は変更される場合があります。
昨日見たニュースに衝撃を受けた。,君の意見を押しつけないでくれ。,こいつ、さっきまで俺の相棒だったのに、もう寝返りやがった。,トムはプロフィール写真のまんまだね。,肩が痛い。,彼はその仕事にぴったりだ。,プリンター内の空のインクカートリッジを交換して下さい。,この本はあの本よりさらに面白い。,塩をすこししか使わないことや野菜をたくさん食べること等が体に良いのさ。,仕様、価格は変更することがあります。
そのニュースは我々に大きな衝撃を与えた。,この氷は割れそうだ。,クッキーは寝返りを打った。,私はあなたには今のままでいてほしい。,彼は肩を怒らせて歩いていた。,彼女のスカートはぴったり合っている。,アルプス山脈はヨーロッパの中央にある。,さらに質問はありますか。,３．電話をかけても、アナウンス等に従って操作したりせず、すぐに切ること。,全てを考慮してもやはり勝てない仕様になっています。
そのニュースは私の会社のことだったので、衝撃が非常に大きかった。,君の重さじゃ氷が割れるよ。,彼は寝返りをうった。,その結果はまだ調べられていないままだ。,彼女の髪は肩まで届いていた。,このドレスは私にぴったりです。,私たちはその部屋の中央に座った。,彼はさらに問題を調査した。,基本的にサイトや雑誌等で販売しているペニス増大サプリメントは効き目がありません。,その話の一部は本当です。
トムは衝撃を受けたようだ。,割れたガラスを踏むな。,彼女がベッドで寝返りばかりうっている。,ラジオをつけたままでは、良く勉強できないことがわかった。,その仕事は私の健康にとって負担だ。,このジャケットはぴったり合う。,彼は舞台の中央に１人のこされた。,その家の内部はとても魅力的だった。,ケアプランの作成等の居宅介護支援事業については、介護保険により負担されます。,人間は自然の一部である。
彼女はクラブの中で抜群に一番上手な選手です。,その氷は硬くて割れない。,彼は一晩中寝返りをうった。,実際感じたままを話してよい。,ガソリンはこちらの負担ですか。,その言葉がそれを説明するにはぴったりだね。,中央線ですね。,彼は日本の内部の事情をよく知っている。,日本に関する記事で一番気に入った記事です。,それは一部木でできている。
彼女抜群ですよ。,箱の中の卵はみな割れていた。,彼女はボールを強く打った。,彼はそれが自分の頭にあるのを見つけた。,私の問題であなたに負担をかけたくない。,イギリスにいる間、私はよくそのガイドブックを参考にした。,トムは部屋の中央に立っていた。,あなたの細い髪だとレイヤーカットは合わないかもしれません。,カタログと価格に関する情報をお送りください。,一部の人々は日本がすべて一番だと思っている。
コーヒーとチョコレートって相性抜群よ。,それは決して消えることなく。,すぐにこの問題に手を打たなければならない。,ジョンは水の上に頭を出した。,費用は彼の負担になるだろう。,ちょっとの間私のスーツケースを見ていてくれませんか。,このタッチは彼女独自のものだ。,カットされていないダイヤモンドは輝きはしない。,パンフレットと価格に関する情報をお送りいただけませんでしょうか。,彼女は計画を一部変更した。
チョコとポテチって相性抜群って言うけど、私はちょっと苦手だな。,私は気づかれることなく彼の後ろを通りすぎた。,田中さんはタイプが打てるんでしょう。,まだ頭がクラクラする。,その費用は彼が負担すべきだ。,ここオーストラリアにいる間、何がしたいですか？。,彼らは独自の文化を持っていた。,1/4カットの白菜を太めの千切りにザクザク切る。,クラシックコンサートに関する情報をください。,変更した？。
彼は抜群に優秀な生徒だ。,彼らは遅れることなくそこに着くことができた。,彼はバットでボールを打った。,彼はハンサムで頭もよい。,モナリザはレオナルド・ダヴィンチによって描かれた。,彼は私達の間で人気がある。,猫それぞれが、独自の性格を持っています。,銀行員の給与カットは一時的なもので、恒久的なものではなかった。,モーテルに関する情報をください。,プロフィール写真を変更したよ。
彼はできるだけ多くその地方の文化を吸収しようとしていた。,人々は話すことなくしゃべる。,タイプは打てますね。,頭がぐらぐらします。,この写真は彼によって撮影された。,私と彼との間には何の関係もない。,私にはそれを解決する独自の方法がある。,私はアイヌの家族の構造を研究した。,返品お断り。,予約を変更したいのですが。
このパジャマはよく汗を吸収します。,自転車は都会の環境を破壊することなく資源利用を持続することのできる道具である。,リナックスをサポートしているベンダーもいます。,見てるだけです。,彼によって何が言われましたか。,歯が抜けて隙間が空いていた。,それぞれの国には、独自の文化があることを理解することが大切です。,私はこの文章の構造には満足してない。,返品した品物の代金を私の口座に振り込んで下さい。,私達の予定は変更できません。
彼は教えられたことを吸収した。,このベンチはしっかりしていますか。,注意：サポートされていない文字は「_」と表示されます。,メールをチェックしたかっただけ。,それぞれのスタイルがあるんだろうね。,男は壁の隙間からのぞいた。,この合計は私のとぴったりあう。,脳の構造は複雑だ。,いったん封を切るとそのテープは返品できません。,予約を変更すると料金が変わりますか。
僕は出来るだけ多くその地方の文化を吸収しようとつとめた。,なかなかしっかりやってるよ。,彼はあなたをすすんでサポートします。,見ているだけです。,それぞれみんなその映画を見に行った。,カーテンの隙間から光が差し込む。,１２と２４と７と１１の合計は５４です。,この増加に加えて、世界の経済構造の変化があった。,購入金額を返金してくれるのかどうか、教えてください。,それは可能性の一つです。
彼はできるだけ多くの文化を吸収しようとつとめた。,皆さんネチケットはしっかり。,検索エンジン「ヤンデックス」はタタール語のサポートも開始した。,見ているだけだ。,それぞれの子供がプレゼントをもらった。,酷使されている不法外国人労働者は制度の隙間にこぼれ落ちてしまうことが多いのです。,数字は合計２３０となる。,その絵は構造がまずい。,注文をキャンセルしますので、返金してください。,トムが来る可能性はある？。
あなたのベッドの下でこれを見つけました。,しっかり頑張ってこい。,検索エンジン「ヤンデクス」はタタール語をもサポートし始めた。,言ってみただけだよ！。,個人はそれぞれ異なっている。,トムさんは寸分の隙間のない紳士でした。,合計でいくらですか。,この夢は実現するだろう。,返金して欲しい。,可能性あるかな？。
下を見ろ。,しっかり勉強しなさい。,私たちの行動の圧倒的な部分は学んで身についたものだ。,動いてる、動いてる。,人はそれぞれ、意見が違う。,トムがカイトを作ったんだ。,これらの数字は合計と合わない。,彼女は夢が実現したので嬉しかった。,私も受けました。,可能性がなくはない。
私は彼女の下で働いている。,橋が圧力で落ちた。,彼らは圧倒的に優勢な敵と戦っていた。,この車は動かない。,我々はその問題を立体的に調査した。,トムはスパゲッティを作った。,彼は私より３個上だよ。,その夢は実現した。,ダンスとモデルのレッスンを受けています。,彼は家を買える可能性を調べた。
彼は車の下から出てきた。,彼は我々の決定に圧力をかけた。,この紙は吸収力が高い。,私の車はなかなか動かない。,クモは常に立体的に蜘蛛の巣を張ります。,それ作れる？。,小さいのを入れて３個です。,夢が実現できて良かったですね。,このレッスンを受けなければなりませんか。,セーフティーボックスがございます。
テーブルの下よ。,ガラスは圧力で割れ得る。,彼は自分の気持ちを絵という形で表現した。,彼は動けませんでした。,今の俺を支えるものは希望だけ。,トムはシチューを作ってます。,ハンバーグを２個注文した。,あのアイデアは実現しそうですか。,新しいエンジンは必要なテストをすべて受けなければならない。,おめでとうございます。
テレビの画像はぼやけて見えた。,彼女は彼に辞めるよう圧力をかけた。,その家は珍しい形をしているので目につきやすかった。,もう、動かないだろうね。,オリンピックへの夢が彼を支えていた。,トムはサンドイッチを作ってるの？。,３個で１００ドルならどうですか。,そんな最初から無理って言ってないで、一度はチャレンジしてみろよ。,今日って、オーディション受けるんじゃないの？。,クリスマスおめでとうございます。
２つの画像がダブってしまった。,彼は私に圧力をかけた。,これらの靴は大きさは違うが形は違わない。,それ体に良くないよ。,赤ちゃんは母親に支えられて歩きました。,いっしょにスケートをしたのが、まるで昨日のことみたいです。,ジョンは私の２個上。,テニスにチャレンジすれば？。,製品コードは何ですか？。,おめでとうございます！。
画像のアップロードの仕方が分かりません。,ボストンを離れることにしました。,これらのクッキーは星の形をしている。,人は自分の体に気をつけなければならない。,彼は彼女を腕で支えて助けたが、しかし彼女は立てなかった。,彼はまるで自分の目で見たようにその事故について私に話した。,ホワイトハウスを設計したのは誰でしょうか。,昔の私だったら、チャレンジしないで、ただ見てるだけだったと思う。,あなたにお見せしたい新しい製品があります。,あなたの顔におめでとうございます。
マユコは原稿の清書をした。,日記が彼女が後に書いた本の基盤となった。,私は損害を弁償した。,私たちはその土地を処分しなければならない。,老年は死に取り巻かれている島である。,フリーマーケットをやっている場所がありますか。,この情報をすぐに提供してくれ。,何かお薦めの本ない？。,空気がなかったら、人間は生きられないだろう。,飛行機からアルプスの雄大な眺めを楽しんだ。
あなたは自分の作文を清書する必要がない。,自由諸国の基盤は民主主義である。,彼女に弁償させたら？。,竿にシーツを全部干しました。,私はあなたの計画に同調します。,好きな場所で食べな。,ペリーはドレークから情報をもらうことにした。,とってもおすすめなんだ。,空気読んでよ。,なんて雄大な風景なんでしょう。
その原稿は手で清書されていた。,２１世紀は経済力を基盤とするようになるだろう。,弁償させてくれよ。,我々の先生は厳しくもあり、かつ優しくもある。,その計画では彼に同調できました。,無料なのですか。,誰も知らないでしょう。,すぐに始めることをお勧めするよ。,タイヤに空気をいっぱい入れよ。,それは実に雄大な眺めだ。
盛田教授は化学学会で司会を務めた。,そうした制度は、社会の構成員が価値を持っていると考えている物にその基盤が置かれた。,弁償代きっちり耳そろえて払わんかい。,問題は、家までいかに早くかつ安全に運転するかだった。,私たちはやっと彼を説得して私たちの考えに同調させた。,それは無料です。,実は彼はそのことを何も知らないです。,トムはメアリーが好きだけど、メアリーはジョンが好きなんだよ。,誰が空気を発見したのか、教えて下さい。,この雄大な海の眺めをごらんなさい。
音楽鑑賞が趣味だ。,家は堅固なセメントの基盤の上に建てられる。,あやふやな手つきで一枚の紙を動かした。,シベリア鉄道は、世界で最も長くかつ最も有名な鉄道である。,彼はあなたの計画に同調するだろう。,これ無料です。,コンパクト型にはおしゃれなデザインが多いですね。,僕はトムのことが好きだけど、彼は僕のことを好きではない。,空気読みなよ。,ひんやりした空気のせいで、トムは意識を回復した。
よい音楽を鑑賞することはそれほど難しいことではない。,休日に着る手頃な着物を今選んでいるところです。,このビタミンは病気に対する抵抗力を強めます。,カナダとの関係は適切かつ冷静な状態が保たれていた。,私は女性が男性より道徳的だという考えにはまったく同調しません。,そのパンフレットは無料です。,今日のあなたはとってもおしゃれ。,ものは相談だけど。,あの地域には入るな。,パーマは自然な感じにしますか。
趣味は音楽鑑賞です。,料金の手ごろなホテルを見つけて下さい。,活動家たちは反対運動を強めています。,パスワードは、覚えやすく、かつ推測されにくいものにしてください。,好奇心は身を滅ぼす。,無料にてお持ちください。,これはあまりおしゃれじゃない。,スケジュールだけど、少し変えたよ。,英語は世界の多くの地域で話されている。,アフリカにはたくさんの自然がある。
趣味はお菓子作りと映画鑑賞です。,手ごろなアパートがあると聞いて、それが気になった。,これは、あの殺人的な公爵に復讐しようという彼の願いを強めただけだ。,私たちの決定に不服ですか。,多くの動物が人間によって滅ぼされた。,日本の自動車メーカーは新しい設備に大きな投資をしている。,おしゃれをしないといけない。,でも、もちろん、ずっと昔のことだけど。,この地域は雨が続くでしょう。,人間は自然の一部である。
彼は、芸術に対する鑑賞力がある。,家はかなりにみえたし、しかも値段が手頃だった。,その問題は会合で激しく論議された。,彼はその決定に不服を唱えた。,彼は酒で身を滅ぼした。,そのホテルは設備がよい。,トムはおしゃれに全く関心がない。,軽井沢は避暑地として有名である。,インディアンがこの地域に住んだ。,私たちは自然をよい状態にしておかなければなりません。
殴りたくなるような顔をしていますね。,私はこのワープロを手ごろな値段で買った。,それを今論議するのはまだ早い。,彼は不服そうに口をとがらせた。,核兵器はわが地球を滅ぼすと思う。,諸設備の費用は払っていただきます。,サーバーがダウンしてて、メールチェックできない。,海岸の避暑地は、例えばニューボートがそうだが、夏には非常に混雑する。,この地域に人が住んだことは全くない。,アフリカは自然がいっぱいだ。
トムはメアリーを殴っている。,ドライバーは車を加速させた。,その問題は自然に論議を呼びました。,それについて何か不服があるのですか。,人民の、人民による、人民のための政治をこの世から滅ぼしてはならない。,この病院には新しい設備がいろいろ備わっている。,クロールできる？。,気象庁は今晩雨が降ると言っている。,ジョンと言えば、彼の妹はどうなったかな。,彼はそのきれいな女性に心を奪われた。
トムに殴られた。,列車は加速した。,論議は最後に喧嘩になった。,彼女は疲れて死にそうだと不服をいいながら長椅子に身を投げた。,事前の申し込みは必要ありません。,会社は新しい設備に投資すべきだというのが私たちの助言です。,チェスはできないの。,なんだか目が冴えちゃって、眠れなくなっちゃった。,スポーツといえば、あなたはどんなスポーツをされますか。,若い男に彼女はバッグを奪われた。
彼は間違って私を殴った。,その政策は、インフレを加速させるだけだ。,彼は彼女と論議するほどばかではない。,別館は本館の北側にある。,事前に準備しておこうよ。,トム・ジョーンズ氏が、この新しい作業アイテムのプロジェクトリーダーになることになりました。,できた？。,昨日ゆっくり休んだ分、今日は頭が冴えている。,私が持っているものと言えば本だけです。,その男は私から財布を奪った。
彼は急に私を殴りだした。,彼は車を加速し、私に追いついた。,彼はその問題について幹部の何人かと協議した。,このパジャマは、男女兼用です。,事前にお知らせします。,ロボットは人間よりもたくさんの作業ができる。,トムはテニスをすることができない。,もう午前3時だけど、目が冴えて眠れる気がしない。,私と言えば、こちらの方が好きだ。,お前はすべてを奪っていった。
たちまちその地域一帯に恐怖が広まった。,この実験においては、粒子Ｍを水平方向に加速してやることが非常に重要である。,この組織は幹部ばかりが名を連ね、果たして決断を下せるのか怪しいものだ。,この書斎は客間兼用だ。,事前にお知らせいたします。,クリスは明日作業できない。,このサイトには、役立つ記事がたくさん掲載してある。,私って冴えてる！。,私といえば、こちらの方がすきだ。,光に目を奪われないで。
